{
  "$schema": "https://json-schema.org/draft/2020-12/schema",
  "$id": "https://contracts.tynext.id/rain/pts/telemetry-1.0.schema.json",
  "title": "RAIN PTS — telemetry",
  "description": "Payload topic rain/pts/{class}/{deviceId}/telemetry. Datar (tanpa nesting dalam, tanpa array) supaya bisa disusun langsung dari struct TwinCAT oleh TF6701.",
  "type": "object",
  "additionalProperties": false,
  "required": ["schemaVersion", "deviceId", "ts", "seq", "metrics"],
  "properties": {
    "schemaVersion": { "$ref": "#/$defs/schemaVersion" },
    "deviceId": { "$ref": "#/$defs/deviceId" },
    "ts": { "$ref": "#/$defs/ts" },
    "seq": {
      "description": "Counter yang naik per device. Dipakai untuk mendeteksi gap, bukan sebagai primary key.",
      "type": "integer",
      "minimum": 0
    },
    "metrics": {
      "description": "Hanya angka. Device class breaker dan gen mengirim objek kosong karena dayanya tidak terukur per unit.",
      "type": "object",
      "propertyNames": { "$ref": "#/$defs/tagName" },
      "additionalProperties": { "type": "number" }
    },
    "state": {
      "description": "Nilai non-numerik (enum atau boolean). Opsional.",
      "type": "object",
      "minProperties": 1,
      "propertyNames": { "$ref": "#/$defs/tagName" },
      "additionalProperties": { "type": ["string", "boolean"] }
    }
  },
  "$defs": {
    "schemaVersion": {
      "description": "Versi kontrak payload. Mulai dari \"1.0\".",
      "type": "string",
      "pattern": "^[0-9]+\\.[0-9]+$"
    },
    "deviceId": {
      "description": "Harus sama dengan segmen {deviceId} di topic.",
      "type": "string",
      "pattern": "^[a-z][a-z0-9-]*$",
      "maxLength": 32
    },
    "ts": {
      "description": "ISO 8601 UTC dengan milidetik, diambil dari jam PLC (NTP). Persis 3 digit pecahan dan diakhiri Z.",
      "type": "string",
      "format": "date-time",
      "pattern": "^[0-9]{4}-[0-9]{2}-[0-9]{2}T[0-9]{2}:[0-9]{2}:[0-9]{2}\\.[0-9]{3}Z$"
    },
    "tagName": {
      "description": "snake_case. Konvensi satuan ada di akhiran (_kw, _kvar, _pct, _v, _a, _hz); beberapa tag warisan tidak bersufiks (eta_link, v, irradiance_wm2) sehingga sufiks tidak dipaksakan di schema.",
      "type": "string",
      "pattern": "^[a-z][a-z0-9_]*$",
      "maxLength": 48
    }
  }
}
